{
  "$schema": "owner-decision-request.schema.json",
  "program_id": "<program-id>",
  "decision_id": "<target-id>.acceptance",
  "decision_kind": "family_acceptance",
  "status": "accepted",
  "revision": 1,
  "decision_text": "<agent-summary-of-unambiguous-natural-language-decision>",
  "owner_input": "<exact-user-input>",
  "target": {
    "artifact_kind": "review_board",
    "artifact_id": "<target-id>",
    "revision": 1,
    "validation_profile": "<review-profile>",
    "path": "<reviewed-artifact-path>"
  }
}
